{
  "id": "SRC-20261022-002",
  "type": "official_publication",
  "url": "https://legalinfo.moj.gov.cn/zhfxfzzx/fzzxyw/202506/t20250620_521303.html",
  "title": "公安机关发布20个防诈关键词",
  "publisher": "司法部智慧普法平台（转载公安部网站信息）",
  "published_at": "2025-06-20",
  "collected_at": "2026-10-22",
  "submitted_by": "assistant_research",
  "access_status": "accessible",
  "review_status": "pending_human_approval",
  "provenance_note": "官方网页已可核验；具体风险模式仍须人工逐条审核后才能进入 App 生效知识。",
  "claims_extracted": [],
  "privacy_review": "not_required",
  "license_note": "Store short factual paraphrases and links rather than article text."
}
