{
  "id": "SRC-20261022-003",
  "type": "official_publication",
  "url": "https://ch.china-embassy.gov.cn/ls_fw_s/aqtx/202607/t20260701_11956013.htm",
  "title": "《2026版防范电信网络诈骗宣传手册》重磅发布",
  "publisher": "中国驻瑞士大使馆（介绍公安部刑侦局发布的手册）",
  "published_at": "2026-07-01",
  "collected_at": "2026-10-22",
  "submitted_by": "assistant_research",
  "access_status": "accessible",
  "review_status": "pending_human_approval",
  "provenance_note": "仅核验了手册发布介绍页；完整手册内容尚未在项目内逐条核查。",
  "claims_extracted": [],
  "privacy_review": "not_required",
  "license_note": "Verify reuse rights for full copies or media."
}
